{
  "id": "PRICE-20260716-000002",
  "productId": "HR-RAM-DDR5-000002",
  "retailerId": "RETAILER-0001",
  "observedAt": "2026-07-16T00:40:00Z",

  "price": 529.99,
  "currency": "USD",
  "availability": "low-stock",
  "condition": "new",
  "sellerType": "marketplace",

  "shipping": {
    "costKnown": true,
    "cost": 0,
    "currency": "USD",
    "notes": "Free Amazon Prime delivery displayed. The item shipped from Amazon."
  },

  "discount": null,

  "affiliate": {
    "isAffiliateLink": false,
    "network": null,
    "trackingCodePresent": false
  },

  "sourceUrl": "https://www.amazon.com/dp/B0H6NH4RP8",

  "verification": {
    "status": "verified",
    "method": "manual",
    "verifiedAt": "2026-07-16T00:40:00Z",
    "verifiedBy": "Mirabelle Labs",
    "notes": "Observed directly on Amazon. The listing matched manufacturer part number F5-6000A3636F16GX2-TZ5NXRW. The listing showed only eight units remaining. Sold by RACERSPEED INC. and shipped by Amazon."
  },

  "metadata": {
    "createdAt": "2026-07-16T00:40:00Z",
    "updatedAt": "2026-07-16T00:40:00Z",
    "notes": "Second canonical Mercury price observation."
  }
}